{
  "id": "9b0c1d2e-3f4a-4b5c-6d7e-9f0a1b2c3d4e",
  "type": "fare.payment.settled",
  "source": "commerce-api",
  "time": "2025-01-15T17:50:22Z",
  "data": {
    "payment_id": "a8b9c0d1-2e3f-4a4b-5c6d-8e9f0a1b2c3d",
    "mojaloop_transfer_id": "sim-trf-9f2c1a00",
    "amount_minor": 280,
    "currency": "EUR",
    "settled_at": "2025-01-15T17:50:21Z"
  }
}
